{
  "$schema": "http://json-schema.org/draft-07/schema#",
  "type": "object",
  "properties": {
    "fingerprint": {
      "type": "string",
      "pattern": "^([A-F0-9]{32}|[A-F0-9]{40}|[A-F0-9]{64})$",
      "description": "Valid GPG fingerprint length (128-bit v3, 160-bit v4, or 256-bit v6), uppercased"
    },
    "label": {
      "type": "string",
      "description": "The label or name associated with the individual or entity, typically matching the name on the GPG key."
    },
    "sources": {
      "type": "array",
      "minItems": 1,
      "items": {
        "type": "object",
        "properties": {
          "type": {
            "type": "string",
            "enum": [
              "url",
              "cache"
            ],
            "description": "The type of source: 'url' for a web URL, 'cache' for a local copy of the public key."
          },
          "uri": {
            "type": "string",
            "description": "The URI of the source, which can be a URL or a copy of the PGP key block with newline characters escaped (see also bin/keyblock-oneline.sh)."
          }
        },
        "required": [
          "type",
          "uri"
        ],
        "additionalProperties": false
      },
      "description": "A list of sources providing the key or related information, which can be a URL or a copy of key data with newline characters escaped (see also bin/keyblock-oneline.sh)."
    },
    "refs": {
      "type": "array",
      "minItems": 1,
      "uniqueItems": true,
      "items": {
        "type": "object",
        "properties": {
          "date": {
            "type": "string",
            "format": "date",
            "description": "The date when the verification or cross-signing took place, in YYYY-MM-DD format."
          },
          "comment": {
            "type": "string",
            "description": "A brief description of what the reference verifies or supports (e.g., project affiliation, key ownership)."
          },
          "artifact": {
            "type": "string",
            "description": "A cryptographic artifact (i.e. clearsigned message) demonstrating possession of a specific key (i.e. signing subkey)"
          },
          "url": {
            "oneOf": [
              {
                "type": "string",
                "format": "uri",
                "description": "A URL pointing to an authoritative source or resource that validates the reference."
              },
              {
                "type": "array",
                "items": {
                  "type": "string",
                  "format": "uri",
                  "description": "A list of related URLs pointing to authoritative sources or resources that validate the reference."
                },
                "description": "A URL (or an array of related URLs) pointing to authoritative sources or resources that validate the reference."
              }
            ]
          },
          "dns": {
            "type": "string",
            "pattern": "^[A-Za-z0-9]+\\._openpgpkey\\.[A-Za-z0-9]([A-Za-z0-9-]{0,61}[A-Za-z0-9])?(\\.[A-Za-z0-9]([A-Za-z0-9-]{0,61}[A-Za-z0-9])?)*$",
            "description": "Valid DNS domain name consisting of one or more labels (separated by dots), with each label containing only letters, numbers, and hyphens, and no label being longer than 63 characters. Provided for OPENPGPKEY DNS resource records (https://datatracker.ietf.org/doc/html/draft-ietf-dane-openpgpkey-06#section-2)."
          },
          "type": {
            "type": "string",
            "enum": [
              "role",
              "user",
              "key",
              "sig1",
              "sig2",
              "sig3",
              "csp"
            ],
            "description": "The type of verification indicated by the evidence provided: project affiliation (role), self-attestation (user), private key use (key), certified by another key holder (sig1, sig2, sig3), certified by a Credential Service Provider (CSP)"
          }
        },
        "required": [
          "date",
          "comment",
          "type"
        ],
        "additionalProperties": false
      },
      "description": "A list of references that provide evidence to support the identity assertion. Each reference must include a date, comment, and type."
    },
    "tags": {
      "type": "array",
      "items": {
        "type": "string",
        "pattern": "[^,]",
        "description": "A list of tags or labels that categorize or identify the individual or entity (e.g., 'OWASP', 'developer')."
      },
      "description": "Tags associated with the identity, which help categorize or identify the individual or entity."
    }
  },
  "required": [
    "fingerprint",
    "label",
    "refs"
  ],
  "additionalProperties": false
}
