{
    "fingerprint": "6D18FD63708FCCA079B68CCE026691839355EBCA",
    "label": "Henri Mikkonen",
    "sources": [
      {
        "type": "url",
        "uri": "https://shibboleth.net/downloads/PGP_KEYS"
      }
    ],
    "refs": [
      {
        "date": "2022-04-01",
        "comment": "Self-verified during 2022-04-01 dev call.",
        "url": "https://shibboleth.atlassian.net/wiki/spaces/DEV/pages/2951020545/2022-04-01",
        "type": "user"
      },
      {
        "date": "2022-04-01",
        "comment": "Listed as project lead with other named collaborators in Shibboleth projects: Scott Cantor, Philip Smart, Rod Widdowson, Steven Premeau, Tom Zeller, John W. O'Brien, Daniel Fisher.",
        "url": "https://shibboleth.atlassian.net/jira/projects",
        "type": "role"
      }
    ],
    "tags": [
      "Shibboleth"
    ]
  }
