{
  "fingerprint": "0675BD19F4FFE3AD0B2D6FEBADA2860895AE3D91",
  "label": "Rocky Linux 9 - Beta Key V1/2022 <releng@rockylinux.org>",
  "sources": [
    {
      "type": "url",
      "uri": "https://dl.rockylinux.org/pub/rocky/RPM-GPG-KEY-rockyofficial"
    }
  ],
  "refs": [
    {
      "date": "2021-02-14",
      "comment": "Listed with release packages as official signing key: RPM-GPG-KEY-Rocky-9-Testing (sha256:8e7fe59a799b38b32112ffa45c5aab83a44144556e1e06ab6ff149a547a1d41e)",
      "url": "https://dl.rockylinux.org/pub/rocky/",
      "type": "role"
    },
    {
      "date": "2024-03-31",
      "comment": "Listed with other Project Keys and instructions for verifying key fingerprints: Rocky Linux 9 (Testing)",
      "url": ["https://github.com/rocky-linux/rockylinux.org/blob/develop/resources/gpg-key-info.md", "https://web.archive.org/web/20240331063950/https://rockylinux.org/keys/", "https://rockylinux.org/resources/gpg-key-info", "https://rockylinux.org/keys"],
      "type": "role"
    },
    {
      "date": "2025-03-17",
      "comment": "Listed in BaseOS source package: rocky-release-9.5-1.2.el9.src.rpm (sha256:975db6f5e89fc5538a5a4b296d66d3fe1fe6a0f1e557dfb95183dec148d8ca79)",
      "url": "https://dl.rockylinux.org/pub/rocky/9/BaseOS/source/tree/Packages/r/rocky-release-9.5-1.2.el9.src.rpm",
      "type": "role"
    }
  ],
  "tags": [
    "Rocky Linux"
  ]
}